
canonical_input,grammar_id,category,title,title_ar,definition,definition_ar,meta_json
grammar|WORD,WORD,classification,Word,كلمة,"The basic linguistic unit; Arabic words are classified into nouns (ism), verbs (fi'l), and particles (harf)",الوحدة اللغوية الأساسية؛ الكلمات في العربية تنقسم إلى اسم وفعل وحرف,{}
grammar|NOUN,NOUN,word_type,Noun (Ism),اسم,"A noun (ism) denotes a person, place, thing, idea, adjective, adverb or special mudāf in Arabic grammar",الاسم يدل على شخص أو مكان أو شيء أو فكرة أو صفة أو ظرف أو مُضاف خاص,"{""parent"": ""WORD""}"
grammar|VERB,VERB,word_type,Verb (Fi'l),فعل,A verb (fi'l) expresses an action or occurrence associated with a time,الفعل يدل على حدث مقترن بزمن,"{""parent"": ""WORD""}"
grammar|PARTICLE,PARTICLE,word_type,Particle (Harf),حرف,A particle has meaning only when combined with other words; it does not stand alone,الحرف لا معنى له إلا مع غيره ولا يستقل بذاته,"{""parent"": ""WORD""}"
grammar|SENTENCE,SENTENCE,classification,Sentence,جملة,A combination of words forming a complete thought; Arabic sentences are either nominal or verbal,مجموعة كلمات تكوِّن معنى كاملاً؛ الجملة في العربية اسمية أو فعلية,{}
grammar|NOMINAL_SENTENCE,NOMINAL_SENTENCE,sentence_type,Nominal sentence,جملة اسمية,A sentence that begins with a noun and consists of a subject (mubtada) and a predicate (khabar),جملة تبدأ باسم وتتكون من مبتدأ وخبر,"{""parent"": ""SENTENCE""}"
grammar|VERBAL_SENTENCE,VERBAL_SENTENCE,sentence_type,Verbal sentence,جملة فعلية,"A sentence that begins with a verb and contains the verb, its subject and possibly objects and complements",جملة تبدأ بفعل وتحتوي على الفعل وفاعله وقد تتضمن مفعولات وتفاصيل أخرى,"{""parent"": ""SENTENCE""}"
grammar|FRAGMENT,FRAGMENT,classification,Fragment,تركيب,"A phrase or fragment that contains fewer than the full components of a sentence, such as possessive, prepositional or adjectival phrases",عبارة أو تركيب لا يكتمل بمعنى الجملة الكاملة مثل التراكيب الإضافية أو الجار والمجرور أو الصفة والموصوف,{}
grammar|IDAFA_FRAGMENT,IDAFA_FRAGMENT,fragment_type,Idāfa phrase,إضافة,A possessive construction joining two nouns; the first noun (mudāf) has no tanween or al- and the second noun (mudāf ilayh) is in the genitive case,تركيب ملكية يربط بين اسمين؛ المضاف بلا تنوين ولا أل والمضاف إليه في حالة الجر,"{""parent"": ""FRAGMENT""}"
grammar|MUDAF_ROLE,MUDAF_ROLE,fragment_role,Mudāf,المضاف,The first noun in an idāfa construction; it is possessed and becomes definite if the mudāf ilayh is definite,الاسم الأول في الإضافة؛ يدل على المملوك ويصبح معرفاً إذا كان المضاف إليه معرفاً,"{""parent"": ""IDAFA_FRAGMENT""}"
grammar|MUDAF_ILAYH_ROLE,MUDAF_ILAYH_ROLE,fragment_role,Mudāf ilayh,المضاف إليه,The second noun in an idāfa construction; always takes the genitive case and determines the definiteness of the mudāf,الاسم الثاني في الإضافة؛ يأتي مجروراً ويحدد تعريف المضاف,"{""parent"": ""IDAFA_FRAGMENT""}"
grammar|JAR_MAJRUR_FRAGMENT,JAR_MAJRUR_FRAGMENT,fragment_type,Prepositional phrase (jar–majrūr),جار ومجرور,A phrase consisting of a preposition (harf jarr) and the noun it governs; the noun becomes genitive and the phrase must attach to a verb or predicate,عبارة تتكون من حرف جر والاسم التابع له؛ الاسم يكون في حالة الجر ويتعلق بالفعل أو الخبر,"{""parent"": ""FRAGMENT""}"
grammar|HARF_NASB_FRAGMENT,HARF_NASB_FRAGMENT,fragment_type,Harf nasb phrase,حرف نصب واسمها,A phrase containing a particle of nasb (harf nasb) that causes the following noun to be in the accusative case; intervening phrases such as prepositional phrases or special mudāf may occur,تركيب يحتوي على حرف نصب يجعل الاسم بعده في حالة النصب؛ قد يتخلل التركيب جار ومجرور أو مضاف خاص,"{""parent"": ""FRAGMENT""}"
grammar|MAWSOOF_SIFA_FRAGMENT,MAWSOOF_SIFA_FRAGMENT,fragment_type,Mawsoof–Sifa phrase,موصوف وصفة,"A noun–adjective phrase where the adjective (sifa) follows the noun (mawsoof) and agrees with it in status, number, gender and definiteness",تركيب اسم وصفة، تتبع الصفة الموصوف وتطابقه في الإعراب والعدد والجنس والتعريف,"{""parent"": ""FRAGMENT""}"
grammar|MAWSOOF,MAWSOOF,fragment_role,Mawsoof (described noun),الموصوف,"The noun being described in a mawsoof–sifa phrase; it must precede the adjective and cannot be a pronoun, demonstrative or relative pronoun",الاسم الذي يوصَف في تركيب الموصوف والصفة؛ يأتي قبل الصفة ولا يكون ضميراً أو اسم إشارة أو اسم موصول,"{""parent"": ""MAWSOOF_SIFA_FRAGMENT""}"
grammar|SIFA_ADJ,SIFA_ADJ,fragment_role,Sifa (adjective),صفة,"The adjective in a mawsoof–sifa phrase; it matches the mawsoof in status, number, gender and definiteness",الصفة في تركيب الموصوف والصفة؛ تطابق الموصوف في الإعراب والعدد والجنس والتعريف,"{""parent"": ""MAWSOOF_SIFA_FRAGMENT""}"
grammar|DEMONSTRATIVE_PHRASE,DEMONSTRATIVE_PHRASE,fragment_type,Demonstrative phrase,اسم إشارة ومشار إليه,"A phrase consisting of a demonstrative pronoun (ism ishara) and the noun being pointed to (mushar ilayh); the demonstrative matches the noun in number, gender and definiteness",تركيب يتألف من اسم إشارة والاسم المشار إليه؛ يطابق اسم الإشارة الاسم المشار إليه في العدد والجنس والتعريف,"{""parent"": ""FRAGMENT""}"
grammar|ISM_ISHARA,ISM_ISHARA,fragment_role,Ism Ishara,اسم الإشارة,A demonstrative pronoun used to point to something in a demonstrative phrase,ضمير إشارة يُستخدم للإشارة إلى شيء في تركيب اسم الإشارة,"{""parent"": ""DEMONSTRATIVE_PHRASE""}"
grammar|MUSHAR_ILAYH,MUSHAR_ILAYH,fragment_role,Mushar Ilayh,المشار إليه,The noun being pointed to by a demonstrative pronoun in a demonstrative phrase; typically has the definite article and dictates the agreement of the demonstrative,الاسم الذي يُشار إليه في تركيب اسم الإشارة؛ غالباً ما يكون معرفاً ويحدد موافقة اسم الإشارة,"{""parent"": ""DEMONSTRATIVE_PHRASE""}"
grammar|MUTAALQ_BIL_KHABAR,MUTAALQ_BIL_KHABAR,sentence_part,Attachment to predicate,متعلق بالخبر,A phrase (prepositional or adverbial) that attaches to the predicate in a nominal sentence; often a jar–majrūr or special mudāf,عبارة (جار ومجرور أو مضاف خاص) ترتبط بالخبر في الجملة الاسمية ولا تُعد جزءاً منه,"{""parent"": ""NOMINAL_SENTENCE""}"
grammar|MUTAALQ_BIL_FIIL,MUTAALQ_BIL_FIIL,sentence_part,Attachment to verb,متعلق بالفعل,"A phrase attached to the verb in a verbal sentence to indicate circumstances like place, time or manner; often a prepositional phrase",عبارة ترتبط بالفعل في الجملة الفعلية لتوضيح المكان أو الزمان أو الكيفية؛ غالباً ما تكون جاراً ومجروراً أو ظرفاً,"{""parent"": ""VERBAL_SENTENCE""}"
grammar|STATUS_PROPERTY,STATUS_PROPERTY,noun_property,Status (I'rāb),الإعراب,"The grammatical case or state of a noun indicated by changes at the end of the word; the basic states are rafʿ (nominative), naṣb (accusative) and jarr (genitive)",الحالة النحوية للاسم التي يدل عليها التغيير في آخر الكلمة؛ الحالات الأساسية هي الرفع والنصب والجر,"{""parent"": ""NOUN""}"
grammar|HEAVY_ISM,HEAVY_ISM,noun_property,Heavy noun,اسم ثقيل,A noun that retains the extra “n” sound (tanween or nūn) at the end by default; a noun is heavy until it is made light or definite,اسم يحمل التنوين أو حرف النون في آخره بشكل افتراضي؛ الاسم يكون ثقيلاً حتى يُخفَّف أو يُعرَّف,"{""parent"": ""STATUS_PROPERTY""}"
grammar|LIGHT_ISM,LIGHT_ISM,noun_property,Light noun,اسم خفيف,"A noun that has its final tanween or extra n removed for reasons such as being mudāf, vocative, partially flexible or following a categorical negation",اسم يُحذف منه التنوين أو النون الزائدة لأسباب مثل كونه مضافاً أو منادى أو غير منصرف أو بعد لا النافية للجنس,"{""parent"": ""STATUS_PROPERTY""}"
grammar|IRRELEVANT_STATUS,IRRELEVANT_STATUS,noun_property,Irrelevant status,حالة غير معتبرة,"When a noun begins with the definite article al-, we do not classify it as heavy or light; the article relates to definiteness rather than status",إذا بدأ الاسم بأل التعريف فلا يُصنَّف إلى ثقيل أو خفيف؛ لأن أل تتعلق بالتعريف لا بالثقل,"{""parent"": ""STATUS_PROPERTY""}"
grammar|FLEXIBILITY_PROPERTY,FLEXIBILITY_PROPERTY,noun_property,Flexibility,المرونة,"The ability of a noun to change its ending according to grammatical case; nouns may be fully flexible, non-flexible or partially flexible",قدرة الاسم على تغيير آخره وفق الحالات الإعرابية؛ الأسماء قد تكون معربة أو مبنية أو غير منصرفة,"{""parent"": ""NOUN""}"
grammar|FULLY_FLEXIBLE,FULLY_FLEXIBLE,noun_property,Fully flexible noun,اسم معرب (منصرف),"A noun whose ending changes in all three grammatical cases; common nouns show tanween endings in rafʿ, naṣb and jarr",اسم يتغير آخره في الحالات الثلاث ويأخذ التنوين في الرفع والنصب والجر إذا كان نكرة,"{""parent"": ""FLEXIBILITY_PROPERTY""}"
grammar|NON_FLEXIBLE,NON_FLEXIBLE,noun_property,Non-flexible noun,اسم مبني,A noun whose form does not change; it carries a single form for all cases and its status is understood from context; includes pronouns and demonstratives,اسم لا يتغير آخره ويحمل شكلاً واحداً في جميع الحالات؛ تُعرف حالته من السياق ويشمل الضمائر وأسماء الإشارة,"{""parent"": ""FLEXIBILITY_PROPERTY""}"
grammar|PARTIALLY_FLEXIBLE,PARTIALLY_FLEXIBLE,noun_property,Partially flexible noun,اسم غير منصرف,"A noun that takes only two forms for the three cases; it cannot take tanween or kasra, so the naṣb and jarr forms both have a fatḥa",اسم يأتي بصيغتين فقط للحالات الثلاث؛ لا يقبل التنوين ولا الكسرة، فيكون النصب والجر بفتحة,"{""parent"": ""FLEXIBILITY_PROPERTY""}"
grammar|NUMBER_PROPERTY,NUMBER_PROPERTY,noun_property,Number,عدد,"Indicates the quantity associated with a noun: singular, dual or plural",يدل على الكمية المرتبطة بالاسم: مفرد أو مثنى أو جمع,"{""parent"": ""NOUN""}"
grammar|SINGULAR,SINGULAR,noun_property,Singular noun,مفرد,A noun referring to one entity,اسم يدل على واحد,"{""parent"": ""NUMBER_PROPERTY""}"
grammar|DUAL,DUAL,noun_property,Dual noun,مثنى,A noun referring to two entities; typically marked by endings such as -ān or -ayn,اسم يدل على اثنين؛ غالباً ما يُعرف بانتهائه بألف ونون أو ياء ونون,"{""parent"": ""NUMBER_PROPERTY""}"
grammar|PLURAL,PLURAL,noun_property,Plural noun,جمع,A noun referring to more than two entities; includes sound plurals and broken plurals,اسم يدل على أكثر من اثنين؛ يشمل الجمع السالم والجمع المكسر,"{""parent"": ""NUMBER_PROPERTY""}"
grammar|HUMAN_PLURAL,HUMAN_PLURAL,noun_property,Human plural,جمع إنسان,"A plural referring to human beings; may appear as sound masculine (-ūn/-īn), sound feminine (-āt) or broken plural forms",جمع يدل على البشر؛ قد يأتي بصيغة المذكر السالم أو المؤنث السالم أو الجمع المكسر,"{""parent"": ""PLURAL""}"
grammar|NON_HUMAN_PLURAL,NON_HUMAN_PLURAL,noun_property,Non-human plural,جمع غير عاقل,A plural referring to non-human entities; grammatically treated as singular feminine and often has a sound feminine ending (-āt) or broken plural form,جمع يدل على غير العاقل؛ يُعامل نحويًا معاملة المفرد المؤنث وغالبًا ما ينتهي بألف وتاء أو يأتي جمعًا مكسرًا,"{""parent"": ""PLURAL""}"
grammar|GENDER_PROPERTY,GENDER_PROPERTY,noun_property,Gender,جنس,The grammatical classification of nouns into masculine and feminine,التصنيف النحوي للأسماء إلى مذكر ومؤنث,"{""parent"": ""NOUN""}"
grammar|MASCULINE,MASCULINE,noun_property,Masculine noun,مذكر,The default grammatical gender; nouns that are not classified as feminine are considered masculine,الجنس الافتراضي؛ يُعد الاسم مذكرًا إذا لم يكن مؤنثًا,"{""parent"": ""GENDER_PROPERTY""}"
grammar|FEMININE,FEMININE,noun_property,Feminine noun,مؤنث,A noun considered grammatically feminine due to meaning or form; feminine nouns include biologically female beings and words ending with specific markers or by convention,اسم يُعد مؤنثًا لأسباب معنوية أو شكلية؛ يتضمن ما يدل على الإناث أو ما ينتهي بعلامات التأنيث أو بالتلقي,"{""parent"": ""GENDER_PROPERTY""}"
grammar|FEM_BIO,FEM_BIO,noun_property,Biological feminine noun,مؤنث حقيقي,"A feminine noun referring to a female human or animal (e.g., امرأة, بقرة)",اسم مؤنث يدل على أنثى من البشر أو الحيوانات مثل امرأة وبقرة,"{""parent"": ""FEMININE""}"
grammar|FEM_ENDING,FEM_ENDING,noun_property,Feminine by ending,مؤنث بالتأنيث,"A noun treated as feminine because of its ending, such as the tā’ marbūṭa (ة), alif maqṣūra (ى) or alif mamdūda (ا)",اسم مؤنث بسبب نهايته مثل التاء المربوطة أو الألف المقصورة أو الألف الممدودة,"{""parent"": ""FEMININE""}"
grammar|FEM_PAIRS,FEM_PAIRS,noun_property,Feminine (paired body parts),مؤنث مزدوج,"Names of body parts that come in pairs (e.g., عين, يد) are grammatically feminine",أسماء أعضاء الجسم التي تأتي أزواجًا (مثل عين، يد) تُعامل كمؤنث,"{""parent"": ""FEMININE""}"
grammar|FEM_PLACE,FEM_PLACE,noun_property,Feminine place name,مؤنث مكاني,Proper names of cities and places are treated as feminine in Arabic grammar,أسماء الأمكنة والمدن تُعامل نحويًا كمؤنث,"{""parent"": ""FEMININE""}"
grammar|FEM_NON_HUMAN_PLURAL,FEM_NON_HUMAN_PLURAL,noun_property,Feminine (non-human plural),جمع غير عاقل مؤنث,Plurals referring to non-human entities are treated grammatically as singular feminine,الجمع الدال على غير العاقل يُعامل نحويًا معاملة المفرد المؤنث,"{""parent"": ""FEMININE""}"
grammar|FEM_ARBITRARY,FEM_ARBITRARY,noun_property,Arbitrary feminine,مؤنث سماعي,Words considered feminine by convention without an obvious marker or reason,ألفاظ تُعد مؤنثًا بالسماع دون علامة أو سبب واضح,"{""parent"": ""FEMININE""}"
grammar|TYPE_PROPERTY,TYPE_PROPERTY,noun_property,Type,نوع الاسم,Indicates whether a noun is common (indefinite) or proper (definite),يبين ما إذا كان الاسم نكرة أو علمًا معرَّفًا,"{""parent"": ""NOUN""}"
grammar|TYPE_COMMON,TYPE_COMMON,noun_property,Common noun,اسم نكرة,"A noun referring to a general, non-specific entity; indefinite",اسم يدل على شيء غير محدد وغير معرف,"{""parent"": ""TYPE_PROPERTY""}"
grammar|TYPE_PROPER,TYPE_PROPER,noun_property,Proper noun,اسم علم,"A noun referring to a specific entity; includes names of people, places, pronouns, demonstratives and nouns made definite by al- or idāfa",اسم يدل على شيء محدد؛ يشمل أسماء الأشخاص والأماكن والضمائر وأسماء الإشارة والأسماء المعرفة بأل أو بالإضافة,"{""parent"": ""TYPE_PROPERTY""}"
grammar|TYPE_PROPER_AL,TYPE_PROPER_AL,noun_property,Definite by al-,معرف باللام,A noun made definite by the definite article al- (ال),اسم أصبح معرفًا بدخول أل التعريف عليه,"{""parent"": ""TYPE_PROPER""}"
grammar|TYPE_PROPER_NAME,TYPE_PROPER_NAME,noun_property,Proper name,اسم علم شخص أو مكان,A personal or place name considered proper,اسم شخص أو مكان يعد علمًا معرفًا,"{""parent"": ""TYPE_PROPER""}"
grammar|TYPE_PROPER_MUNADA,TYPE_PROPER_MUNADA,noun_property,Vocative noun,منادى معرف,A noun being addressed using a vocative particle (yā); treated as definite,اسم يُنادى به بواسطة حرف النداء (يا) فيعد معرفًا,"{""parent"": ""TYPE_PROPER""}"
grammar|TYPE_PROPER_PRONOUN,TYPE_PROPER_PRONOUN,noun_property,Pronoun (proper),ضمير معرف,A pronoun functions as a proper noun because it refers to a specific person or thing,الضمير يقوم مقام الاسم العلم لأنه يشير إلى شخص أو شيء محدد,"{""parent"": ""TYPE_PROPER""}"
grammar|TYPE_PROPER_DEMONSTRATIVE,TYPE_PROPER_DEMONSTRATIVE,noun_property,Demonstrative pronoun (proper),اسم إشارة معرف,Demonstrative nouns such as هذا/هذه are inherently definite,أسماء الإشارة مثل هذا وهذه تعتبر معرفة بذاتها,"{""parent"": ""TYPE_PROPER""}"
grammar|TYPE_PROPER_RELATIVE,TYPE_PROPER_RELATIVE,noun_property,Relative pronoun (proper),اسم موصول معرف,Relative pronouns like الذي/التي are definite because they refer to a specific antecedent,الأسماء الموصولة مثل الذي والتي تُعد معرفة لأنها تعود على اسم محدد,"{""parent"": ""TYPE_PROPER""}"
grammar|TYPE_PROPER_IDAFA,TYPE_PROPER_IDAFA,noun_property,Idāfa-defined noun,مضاف معرف,A noun becomes definite when it is the first term (mudāf) in an idāfa where the second term is definite,الاسم يصبح معرفًا إذا كان مضافًا في إضافة والمضاف إليه معرف,"{""parent"": ""TYPE_PROPER""}"
grammar|BALAGHA,BALAGHA,rhetoric,Balāgha,البلاغة,"The science of Arabic eloquence comprising sub-fields such as ilm al-bayān, ilm al-ma'ānī and others to convey meaning effectively and beautifully",علم البلاغة يجمع فنون البيان والمعاني وغيرها لإيصال المعنى بوضوح وجمال,{}
grammar|ILM_BAYAN,ILM_BAYAN,rhetoric_subfield,Ilm al-Bayān,علم البيان,"A subfield of balāgha dealing with clarity of expression through devices like simile (tashbīh), metaphor (istiʿāra), metonymy (kināya) and extended metaphor (majāz mursal)",علم من علوم البلاغة يهتم بإيضاح المعنى باستخدام التشبيه والاستعارة والكناية والمجاز المرسل,"{""parent"": ""BALAGHA""}"
grammar|TASHBIH,TASHBIH,rhetoric_device,Tashbīh (simile),التشبيه,"A figure of speech showing that a thing shares attributes with another using an instrument such as the particle kāf; consists of the compared, the standard, the instrument and the aspect of similarity",أسلوب يبيِّن مشاركة شيء لغيره في صفة بواسطة أداة مثل الكاف، وله أركان: المشبَّه والمشبَّه به والأداة ووجه الشبه,"{""parent"": ""ILM_BAYAN""}"
grammar|ISTIARA,ISTIARA,rhetoric_device,Istiʿāra (metaphor),استعارة,A form of linguistic metaphor (majāz lughawī) in which one element of a simile is omitted; may be explicit (tasrīḥiyya) or implicit (makniyya),نوع من المجاز اللغوي يُحذف فيه أحد طرفي التشبيه؛ قد تكون استعارة تصريحّية أو مكنيّة,"{""parent"": ""ILM_BAYAN""}"
grammar|KINAYA,KINAYA,rhetoric_device,Kināya (metonymy),كناية,An expression in which a word or phrase is used to imply a hidden meaning without explicitly mentioning it,أسلوب بلاغي يُستخدم فيه اللفظ للتعبير عن معنى خفي دون ذكره صراحة,"{""parent"": ""ILM_BAYAN""}"
grammar|MAJAZ_MURSAL,MAJAZ_MURSAL,rhetoric_device,Majāz Mursal (extended metaphor),مجاز مرسل,A rhetorical figure where a word is used in a figurative sense due to a relation other than resemblance; requires a contextual clue (qarīnah) to prevent the literal meaning,أسلوب بلاغي يُستعمل فيه اللفظ في غير معناه الأصلي لعلاقة غير المشابهة مع وجود قرينة تمنع إرادة المعنى الحقيقي,"{""parent"": ""ILM_BAYAN""}"
